{
  "schemaVersion": "chatgpt.browser_control.operation_handle.v1",
  "operationId": "11111111-1111-4111-8111-111111111111",
  "requestDigest": "hmac-sha256:aaaaaaaaaaaaaaaaaaaaaaaaaaaaaaaaaaaaaaaaaaaaaaaaaaaaaaaaaaaaaaaa",
  "surface": "chat",
  "revision": 3,
  "phase": "ready",
  "mutationBoundary": "handoff_may_have_occurred",
  "targetBindingDigest": "hmac-sha256:bbbbbbbbbbbbbbbbbbbbbbbbbbbbbbbbbbbbbbbbbbbbbbbbbbbbbbbbbbbbbbbb"
}
